{"authority_effect":"NONE","bindings":{"chapter_plan":{"path":"data/planning/chapters/ch94.json","sha256":"cacd7c08f626cefa5a068864a9cdc36d890d10aad662dfdd258841fda4b48a3b"},"seed":{"path":"data/planning/scenes/94-S5.json","sha256":"8d2b1403cc2caf16980153aa7dd80e4ff6bafc356b037686fec78a5371475ea4"},"source_packet":{"path":"artifacts/agent_research/phase5/inputs/contract-packet-91-95.json","sha256":"7a044fc4b0b30b9fa3f694714dbe79519af88ff6318819e74a3f38a2e0016816"},"world":{"inputs":[{"path":"data/project/scope.json","sha256":"ecd0c76ea442f5538a3bd5d12f1f3e33d0243318032b5c0446789fb5fdb91dbe"},{"path":"data/world/m3_core.json","sha256":"c4bf1c75fda8994fd846e570a64ae69efeb6ca17cd27e78c1bb1af4d7783d733"},{"path":"data/world/m3_locations.json","sha256":"ed1a4053f1459193777f486b3a9743c5aec28afb7d027dee12684da6e3a9d81b"},{"path":"data/world/m3_presence.json","sha256":"7880480b001c321e50056e887f1285f6c7ccf975aed140d1515967ea925bb3bb"},{"path":"data/world/m3_body.json","sha256":"429ca248ea42aa0601e11a55d40fa446da92cee48936627a83b335ab9b18056e"},{"path":"data/world/m3_resources.json","sha256":"b823f72594d4a2af2216525cbfd3411b00d41c4ad0fa89830348933be6de7668"},{"path":"data/world/m3_knowledge.json","sha256":"d8ee374ec667317af6ef304dc4b66ad7d3ceae9f20753c1b35cf029c73dee18b"},{"path":"data/objects/m4.json","sha256":"5c2719605b0d2b78d3c06d6bb7444c5c5058fd3891879f8dcfa480cd1828b4db"},{"path":"data/knowledge/v03_slice2.json","sha256":"37db9f32aad64636f33eb70a73130160260914e8a4ca987e03f6c45170fa88e7"},{"path":"data/objects/medicine_bowl.yaml","sha256":"ad304b16d955e904b6de156bf88c38f51f0d552698bb7f2ff6ba07bb5572d361"}],"status":"BOUND"}},"chapter":94,"chapter_plan_ref":"data/planning/chapters/ch94.json","entry_checkpoint":{"chapter":null,"kind":"UNKNOWN"},"entry_from":"UNKNOWN","entry_state":[],"event_refs":[],"evidence_effect":"NONE","exit_state":[],"forbidden_beats":[],"id":"94-S5","kind":"AGENT_SCENE_CONTRACT","knowledge_binding":null,"knowledge_event_refs":[],"object_transition_refs":[],"order":5,"participants":[],"participants_status":"UNKNOWN","preconditions":[],"references":{"knowledge":[],"objects":[],"participants":[]},"required_beats":[],"required_objects":[],"revision":"v1","schema_version":1,"status":"DRAFT_GENERATED","unresolved":["entry_from","entry_checkpoint","participants","entry_state","exit_state","event_bindings"]}
